Cluster_ID,Cluster_Name
0,Brucellosis Research and Bioterrorism Preparedness
1,Global Epidemiology and Pathogenic Mechanisms of Rickettsial Diseases
2,Enhancing Preparedness Against Bioterrorism Threats
3,Q Fever Research and Vaccine Development
4,Catastrophic Risk Assessment and Response in Environmental Conservation
5,Global Veterinary Preparedness for Bioterrorism and Zoonotic Threats
6,Global Polio Eradication Strategies and Challenges
7,Staphylococcal Enterotoxin B Research and Bioterrorism Defense
8,Bioterrorism Preparedness and Vaccine Development for Burkholderia Infections
9,Biodefense Strategies and Patent Law Implications
10,Forensic Pathogen Surveillance and Autopsy Innovations
11,Enhancing Rapid Biothreat Detection and Surveillance
12,Bioterrorism Risk Assessment and Management Strategies
13,Francisella tularensis Pathogenesis and Vaccine Development
14,Botulinum Neurotoxin Detection and Therapeutic Strategies
15,Enhancing Syndromic Surveillance for Bioterrorism Detection
16,Enhancing Early Detection and Response to Infectious Disease Outbreaks
17,Advances in Plague Research and Vaccine Development
18,Media Influence on Public Health Crisis Communication
19,Antibiotic Resistance and Therapeutic Strategies for Bacterial Infections
20,Infectious Diseases Management and Diagnosis
21,Medical Reference Materials and Education in Healthcare
22,Preventing Bioterrorism Threats in Southeast Asia
23,Psychological and Public Health Responses to Bioterrorism
24,Alphaviral Encephalitis Research and Vaccine Development
25,Agricultural Bioterrorism Preparedness and Response
26,Global Food Safety and Bioterrorism Preparedness
27,Global Preparedness for Emerging Infectious Diseases
28,Advancements in Microbial Forensics for Bioterrorism Defense
29,Detection and Response to Bioterrorism Agents
30,Bioaerosol Analysis and Detection in Various Environments
31,Development of Ricin and Abrin Detection Technologies
32,Rapid Detection and Identification of Bioterrorism Agents
33,Advanced Molecular Detection of Biological Agents
34,Innovative Biosensor Technologies for Rapid Biohazard Detection
35,Advanced Biosensors for Bioterrorism Detection
36,Advances in Anthrax Pathogenesis and Therapeutics
37,Water Security and Pathogen Detection in Drinking Water Systems
38,Ultraviolet Germicidal Irradiation for Bioterrorism Defense
39,Ethical Governance of Dual-Use Research in Biotechnology
40,Bioterrorism Preparedness and Response Strategies
41,Detection and Identification of Bacillus anthracis for Bioterrorism Preparedness
42,Anthrax Research and Bioterrorism Preparedness
43,Advances in Ebola Virus Vaccine Development
44,Rift Valley Fever Virus Research and Countermeasures
45,Pharmacy Preparedness for Bioterrorism and Disaster Response
46,Advancements in DNA Vaccines for Bioterrorism Defense
47,Global Vaccine Development and Innovation
48,Advances in Immunology and Pathogenesis of Viral Hemorrhagic Fevers
49,Advancements in Smallpox Vaccines and Bioterrorism Preparedness
50,Optimizing Emergency Response in Anti-Bioterrorism Systems
51,Bioterrorism Response Modeling and Preparedness Strategies
52,Mathematical Modeling for Bioterrorism Preparedness and Response
53,Ethical Considerations in Bioterrorism Preparedness and Response
54,Bioterrorism Preparedness and Public Health Law
55,Enhancing Healthcare Professionals' Preparedness for Bioterrorism
56,Bioterrorism Preparedness and Response Strategies
57,Ebola Outbreak Preparedness and Bioterrorism Defense
58,Enhancing Public Health Infrastructure and Preparedness
59,Enhancing Public Health Preparedness for Bioterrorism Incidents
60,Biosecurity Measures in Biomedical Research Facilities
61,Laboratory Response Network for Bioterrorism Preparedness and Detection
62,Bioterrorism Preparedness and Response Strategies in India
63,Global Biosecurity Threats and Emerging Infectious Diseases
64,Enhancing Preparedness Against Bioterrorism Threats
65,Global Bioterrorism Preparedness and Response Strategies
66,Global Health Security and National Policy Integration
67,Global Perspectives on Bioterrorism Threats and Preparedness
68,Global Bioterrorism Preparedness and International Cooperation
69,Bioterrorism Preparedness and Response Strategies

